{
  "version": "0.11.36-rc.7",
  "notes": "Example only. 0.11.36-rc.7-r1 integration candidate; replace URL/signature during real GitHub publication.",
  "pub_date": "2026-09-10T00:00:00Z",
  "platforms": {
    "windows-x86_64": {
      "url": "https://example.invalid/Hytale-Generator-Workbench_0.11.36-rc.7_x64-setup.exe",
      "signature": "EXAMPLE_SIGNATURE_NOT_FOR_RELEASE"
    }
  }
}
